{"checkpoint_historical_deployability_claimed":false,"claim":"Reserved rolling evaluation for this recipe, not historically untouched outcomes.","prior_exposure_disclosure":{"future_policy":"register prospective forecast and evaluation policy before collecting its outcome evidence","no_runtime_import_from_references":true,"records":[{"consequence":"preserve original record; does not establish global blindness","dates":["2025-09-07","2026-09-06"],"exposure":"locally sealed at P07","source":"KDEN v3.75 P07 boundary"},{"consequence":"reserved historical evaluation only; never describe as fresh blind test","dates":["2025-09-07","2026-09-06"],"exposure":"all 365 labels explicitly opened and audited","source":"KDEN_NBM/TRUTH_REPORT.md"},{"consequence":"development context and cross-project contamination ledger","dates":["2024-07-16","2026-09-11"],"exposure":"past-only scores, seasonal/version analyses and specific failures inspected","source":"KDEN_NBM/FINAL_REPORT.md"},{"consequence":"hypothesis source, no new validation evidence","dates":["2021-01-01","2026-08-04"],"exposure":"aggregate baseline/floor diagnostics across overlapping dates","source":"KDEN v3 Layer 1 scientific record"},{"consequence":"cannot restore 2026 blindness after other projects exposed truth","dates":["2025-01-01","2025-12-31"],"exposure":"2025 development market/model results; that iteration did not open 2026 settlement outcomes","source":"KDEN v3 Layer 4 iteration 1 conclusion"},{"consequence":"sunny-day/season hypotheses only; observed cloud gate not an issuance-safe predictor","dates":["2021-01-01","2025-12-31"],"exposure":"2021-2024 selection and 2025 historical holdout findings","source":"KDEN v2 Dataset 1 synthesis"}],"s0_new_label_values_read":0,"schema_version":"R14_EXPOSURE_V1","status":"historical_out_of_time_not_blind"},"prior_exposure_source":"universal_issue_state/experiments/r14_first_model_comparison_v1/config/evidence_exposure.json","prior_exposure_source_sha256":"0e62d4f843a1394010e43cc3cb957c243703d6511e086b73f3d821216c6c6845","schema_version":"R14_TABULAR_EXPOSURE_V1","t01_new_holdout_values_read":false}
